{
  "run_id": "r-003",
  "app": "todo",
  "digest": "sha256:c3d4e5f60718293a4b5c6d7e8f9001122334455667788990aabbccddeeff0011",
  "source_revision": "9f8e7d6c5b4a39281706f5e4d3c2b1a0f9e8d7c6",
  "passed": true,
  "match": { "total": 24, "matched": 24 },
  "failures": [],
  "facts": { "db": "postgres" }
}
